course,program,duration,nos,emgs,misc,ttf,intake,description,remarks,discount,uid
Diploma in Accounting,Diploma,2.5 Years ,,6188,5940,34610,FEB/JUL/SEP,,"deadline 6th Jan, 9th Jun, 6th Jul",,26
Diploma in Management,Diploma,2.5 Years ,,6188,5940,32185,FEB/JUL/SEP,,"deadline 6th Jan, 9th Jun, 6th Jul",,26
Diploma in Investment Management,Diploma,2.5 Years ,,6188,5940,33055,FEB/JUL/SEP,,"deadline 6th Jan, 9th Jun, 6th Jul",,26
Diploma in Islamic Finance,Diploma,2.5 Years ,,6188,5940,32985,FEB/JUL/SEP,,"deadline 6th Jan, 9th Jun, 6th Jul",,26
Diploma in Islamic Banking,Diploma,2.5 Years ,,6188,5940,39855,FEB/JUL/SEP,,"deadline 6th Jan, 9th Jun, 6th Jul",,26
Diploma in Human Capital Management,Diploma,2.5 Years ,,6188,5940,32815,FEB/JUL/SEP,,"deadline 6th Jan, 9th Jun, 6th Jul",,26
Diploma in Retail Management,Diploma,2.5 Years ,,6188,5940,32295,FEB/JUL/SEP,,"deadline 6th Jan, 9th Jun, 6th Jul",,26
Diploma in Logistic Management,Diploma,2.5 Years ,,6188,5940,37750,FEB/JUL/SEP,,"deadline 6th Jan, 9th Jun, 6th Jul",,26
Diploma in Entrepreneurship,Diploma,2.5 Years ,,6188,5940,35455,FEB/JUL/SEP,,"deadline 6th Jan, 9th Jun, 6th Jul",,26
Diploma in Music Technology,Diploma,2.5 Years ,,6188,5940,46915,FEB/JUL/SEP,,"deadline 6th Jan, 9th Jun, 6th Jul",,26
Diploma in Beauty Management,Diploma,2.5 Years ,,6188,5940,33900,FEB/JUL/SEP,,"deadline 6th Jan, 9th Jun, 6th Jul",,26
Diploma in Hair Dressing,Diploma,2.5 Years ,,6188,5940,34235,FEB/JUL/SEP,,"deadline 6th Jan, 9th Jun, 6th Jul",,26
Diploma in Spa Management,Diploma,2.5 Years ,,6188,5940,34295,FEB/JUL/SEP,,"deadline 6th Jan, 9th Jun, 6th Jul",,26
"Diploma in Leisure, Outdoor And Adventure Management",Diploma,2.5 Years ,,6188,5940,34155,FEB/JUL/SEP,,"deadline 6th Jan, 9th Jun, 6th Jul",,26
Diploma in Culinary Arts,Diploma,2.5 Years ,,6188,5940,36125,FEB/JUL/SEP,,"deadline 6th Jan, 9th Jun, 6th Jul",,26
Diploma in Event Management,Diploma,2.5 Years ,,6188,5940,32995,FEB/JUL/SEP,,"deadline 6th Jan, 9th Jun, 6th Jul",,26
Diploma in Fashion Design,Diploma,2.5 Years ,,6188,5940,34585,FEB/JUL/SEP,,"deadline 6th Jan, 9th Jun, 6th Jul",,26
Diploma in Hospitality Management - Tourism,Diploma,2.5 Years ,,6188,5940,33735,FEB/JUL/SEP,,"deadline 6th Jan, 9th Jun, 6th Jul",,26
Diploma in Pattiserrie Arts,Diploma,2.5 Years ,,6188,5940,47115,FEB/JUL/SEP,,"deadline 6th Jan, 9th Jun, 6th Jul",,26
Diploma in Counseling And Guidance,Diploma,2.5 Years ,,6188,5940,34055,FEB/JUL/SEP,,"deadline 6th Jan, 9th Jun, 6th Jul",,26
Diploma in Education - Tesl,Diploma,2.5 Years ,,6188,5940,32405,FEB/JUL/SEP,,"deadline 6th Jan, 9th Jun, 6th Jul",,26
Diploma in Early Childhood Education,Diploma,2.5 Years ,,6188,5940,32405,FEB/JUL/SEP,,"deadline 6th Jan, 9th Jun, 6th Jul",,26
Diploma in Management (Public Relations & Entertainment),Diploma,2.5 Years ,,6188,5940,33965,FEB/JUL/SEP,,"deadline 6th Jan, 9th Jun, 6th Jul",,26
Diploma in Aircraft Maintenance Technology,Diploma,3 Years,,6188,5940,86705,FEB/JUL/SEP,,"deadline 6th Jan, 9th Jun, 6th Jul",,26
Diploma in Computer Engineering,Diploma,2.5 Years ,,6188,5940,34145,FEB/JUL/SEP,,"deadline 6th Jan, 9th Jun, 6th Jul",,26
Diploma in Computer Forensic,Diploma,2.5 Years ,,6188,5940,33075,FEB/JUL/SEP,,"deadline 6th Jan, 9th Jun, 6th Jul",,26
Diploma in Electrical And Electronic Engineering,Diploma,2.5 Years ,,6188,5940,34125,FEB/JUL/SEP,,"deadline 6th Jan, 9th Jun, 6th Jul",,26
Diloma in Mechanical Engineering,Diploma,2.5 Years ,,6188,5940,87850,FEB/JUL/SEP,,"deadline 6th Jan, 9th Jun, 6th Jul",,26
Diploma in Mechanical Engineering (Air Conditioning & Refrigeration),Diploma,2.5 Years ,,6188,5940,83160,FEB/JUL/SEP,,"deadline 6th Jan, 9th Jun, 6th Jul",,26
Diploma in Mechanical Engineering (Highrise Building Maintenance),Diploma,2.5 Years ,,6188,5940,82740,FEB/JUL/SEP,,"deadline 6th Jan, 9th Jun, 6th Jul",,26
Diploma in Business Computing,Diploma,2.5 Years ,,6188,5940,32675,FEB/JUL/SEP,,"deadline 6th Jan, 9th Jun, 6th Jul",,26
Diploma in Games Design And Animation,Diploma,2.5 Years ,,6188,5940,33815,FEB/JUL/SEP,,"deadline 6th Jan, 9th Jun, 6th Jul",,26
Diploma in Graphic Design,Diploma,2.5 Years ,,6188,5940,33490,FEB/JUL/SEP,,"deadline 6th Jan, 9th Jun, 6th Jul",,26
Diploma in Information Technology,Diploma,2.5 Years ,,6188,5940,32760,FEB/JUL/SEP,,"deadline 6th Jan, 9th Jun, 6th Jul",,26
Diploma in Multimedia,Diploma,2.5 Years ,,6188,5940,33470,FEB/JUL/SEP,,"deadline 6th Jan, 9th Jun, 6th Jul",,26
Diploma in Information Technology (Mobile Wireless Technology),Diploma,2.5 Years ,,6188,5940,32935,FEB/JUL/SEP,,"deadline 6th Jan, 9th Jun, 6th Jul",,26
Diploma in Creative Visual,Diploma,2.5 Years ,,6188,5940,53215,FEB/JUL/SEP,,"deadline 6th Jan, 9th Jun, 6th Jul",,26
Diploma in Medical Science,Diploma,3.5 Years ,,6188,5940,57870,FEB/JUL/SEP,,"deadline 6th Jan, 9th Jun, 6th Jul",,26
Diploma in Medical Laboratory Technology,Diploma,3 Years,,6188,5940,56305,FEB/JUL/SEP,,"deadline 6th Jan, 9th Jun, 6th Jul",,26
Diploma in Occupational Safety And Health,Diploma,3 Years,,6188,5940,68025,FEB/JUL/SEP,,"deadline 6th Jan, 9th Jun, 6th Jul",,26
Diploma in Radiotherapy,Diploma,3 Years,,6188,5940,82395,FEB/JUL/SEP,,"deadline 6th Jan, 9th Jun, 6th Jul",,26
Diploma in Medical Assistant,Diploma,3 Years,,6188,5940,58915,FEB/JUL/SEP,,"deadline 6th Jan, 9th Jun, 6th Jul",,26
Diploma in Nursing,Diploma,3 Years,,6188,5940,95000,FEB/JUL/SEP,,"deadline 6th Jan, 9th Jun, 6th Jul",,26
Diploma in Physiotherapy,Diploma,3 Years,,6188,5940,68125,FEB/JUL/SEP,,"deadline 6th Jan, 9th Jun, 6th Jul",,26
Diploma in Sport Science,Diploma,2.5 Years ,,6188,5940,35640,FEB/JUL/SEP,,"deadline 6th Jan, 9th Jun, 6th Jul",,26
Diploma in Ophtalmic Dispensing,Diploma,3 Years,,6188,5940,72895,FEB/JUL/SEP,,"deadline 6th Jan, 9th Jun, 6th Jul",,26
Diploma in Traditional Chinese Medicine,Diploma,2.5 Years ,,6188,5940,70695,FEB/JUL/SEP,,"deadline 6th Jan, 9th Jun, 6th Jul",,26
Diploma in Pharmacy,Diploma,2.5 Years ,,6188,5940,52615,FEB/JUL/SEP,,"deadline 6th Jan, 9th Jun, 6th Jul",,26
Foundation in Science (Biological Science / Health Science),Foundation,1 Year,,6518,1070,20360,FEB/JUL/SEP,,"deadline 6th Jan, 9th Jun, 6th Jul",,26
Foundation in Business,Foundation,1 Year,,6518,1070,18650,FEB/JUL/SEP,,"deadline 6th Jan, 9th Jun, 6th Jul",,26
Foundation in Law,Foundation,1 Year,,6518,1070,18650,FEB/JUL/SEP,,"deadline 6th Jan, 9th Jun, 6th Jul",,26
Foundation in Information Technology,Foundation,1 Year,,6518,1070,18650,FEB/JUL/SEP,,"deadline 6th Jan, 9th Jun, 6th Jul",,26
Foundation in Engineering And Technology,Foundation,1 Year,,6518,1070,18650,FEB/JUL/SEP,,"deadline 6th Jan, 9th Jun, 6th Jul",,26
Foundation in Visual Arts,Foundation,1 Year,,6518,1150,20110,FEB/JUL/SEP,,"deadline 6th Jan, 9th Jun, 6th Jul",,26
Foundation in Tesl,Foundation,1 Year,,6518,1150,18650,FEB/JUL/SEP,,"deadline 6th Jan, 9th Jun, 6th Jul",,26
Bachelor in International Business (Hons),Bachelor,3 Years,,6518,6400,62980,FEB/JUL/SEP,,"deadline 6th Jan, 9th Jun, 6th Jul",,26
Bachelor in Industrial Management (Hons),Bachelor,3 Years,,6518,6400,59905,FEB/JUL/SEP,,"deadline 6th Jan, 9th Jun, 6th Jul",,26
Bachelor in Law And Commerce (Hons),Bachelor,3 Years,,6518,6400,62020,FEB/JUL/SEP,,"deadline 6th Jan, 9th Jun, 6th Jul",,26
Bachelor in Human Capital Management (Hons),Bachelor,3 Years,,6518,6400,58855,FEB/JUL/SEP,,"deadline 6th Jan, 9th Jun, 6th Jul",,26
Bachelor in Accounting (Hons),Bachelor,4 Years,,6518,6400,71540,FEB/JUL/SEP,,"deadline 6th Jan, 9th Jun, 6th Jul",,26
Bachelor in Investment Management (Hons),Bachelor,3 Years,,6518,6400,59220,FEB/JUL/SEP,,"deadline 6th Jan, 9th Jun, 6th Jul",,26
Bachelor in Islamic Management (Hons),Bachelor,3 Years,,6518,6400,62910,FEB/JUL/SEP,,"deadline 6th Jan, 9th Jun, 6th Jul",,26
Bachelor in Finance (Hons),Bachelor,3 Years,,6518,6400,65340,FEB/JUL/SEP,,"deadline 6th Jan, 9th Jun, 6th Jul",,26
Bachelor in Marketing With Psychology (Hons),Bachelor,3 Years,,6518,6400,60365,FEB/JUL/SEP,,"deadline 6th Jan, 9th Jun, 6th Jul",,26
Bachelor in Retail Management (Hons),Bachelor,3 Years,,6518,6400,58855,FEB/JUL/SEP,,"deadline 6th Jan, 9th Jun, 6th Jul",,26
Bachelor in Takaful (Hons),Bachelor,3 Years,,6518,6400,71845,FEB/JUL/SEP,,"deadline 6th Jan, 9th Jun, 6th Jul",,26
Bachelor in Islamic Finance (Hons),Bachelor,3 Years,,6518,6400,71190,FEB/JUL/SEP,,"deadline 6th Jan, 9th Jun, 6th Jul",,26
Bachelor in Islamic Banking (Hons),Bachelor,3 Years,,6518,6400,71845,FEB/JUL/SEP,,"deadline 6th Jan, 9th Jun, 6th Jul",,26
Bachelor in Hospitality Management - Tourism (Hons),Bachelor,3.8 Years,,6518,6400,63990,FEB/JUL/SEP,,"deadline 6th Jan, 9th Jun, 6th Jul",,26
Bachelor in Event Management (Hons),Bachelor,3 Years,,6518,6400,62865,FEB/JUL/SEP,,"deadline 6th Jan, 9th Jun, 6th Jul",,26
Bachelor in Culinary Arts (Hons),Bachelor,3 Years,,6518,6400,59245,FEB/JUL/SEP,,"deadline 6th Jan, 9th Jun, 6th Jul",,26
Bachelor in Fashion Design With Marketing(Hons),Bachelor,3 Years,,6518,6400,56735,FEB/JUL/SEP,,"deadline 6th Jan, 9th Jun, 6th Jul",,26
"Bachelor in Leisure, Outdoor And Adventure Maangement (Hons)",Bachelor,3 Years,,6518,6400,65060,FEB/JUL/SEP,,"deadline 6th Jan, 9th Jun, 6th Jul",,26
Bachelor in Spa Management (Hons),Bachelor,3 Years,,6518,6400,55205,FEB/JUL/SEP,,"deadline 6th Jan, 9th Jun, 6th Jul",,26
Bachelor in Music Technology (Hons),Bachelor,3 Years,,6518,6400,83640,FEB/JUL/SEP,,"deadline 6th Jan, 9th Jun, 6th Jul",,26
Bachelor in Accessories Design (Hons),Bachelor,3 Years,,6518,6400,66245,FEB/JUL/SEP,,"deadline 6th Jan, 9th Jun, 6th Jul",,26
Bachelor in Pattsserie Arts (Hons),Bachelor,3 Years,,6518,6400,70860,FEB/JUL/SEP,,"deadline 6th Jan, 9th Jun, 6th Jul",,26
Bachelor in Beauty And Hair Management (Hons),Bachelor,3 Years,,6518,6400,63970,FEB/JUL/SEP,,"deadline 6th Jan, 9th Jun, 6th Jul",,26
Bachelor in Education - Tesl (Hons),Bachelor,3 Years,,6518,6400,59505,FEB/JUL/SEP,,"deadline 6th Jan, 9th Jun, 6th Jul",,26
Bachelor in Early Childhood Education (Hons),Bachelor,3 Years,,6518,6400,59285,FEB/JUL/SEP,,"deadline 6th Jan, 9th Jun, 6th Jul",,26
Bachelor in Counseling And Guidance (Hons),Bachelor,4 Years,,6518,6400,59525,FEB/JUL/SEP,,"deadline 6th Jan, 9th Jun, 6th Jul",,26
Bachelor in Education (Visual Arts)(Hons),Bachelor,3 Years,,6518,6400,62680,FEB/JUL/SEP,,"deadline 6th Jan, 9th Jun, 6th Jul",,26
Bachelor in Education (Science) (Hons),Bachelor,3 Years,,6518,6400,59786,FEB/JUL/SEP,,"deadline 6th Jan, 9th Jun, 6th Jul",,26
Bachelor in Education (Physical Education And Health)(Hons),Bachelor,3 Years,,6518,6400,62531,FEB/JUL/SEP,,"deadline 6th Jan, 9th Jun, 6th Jul",,26
Bachelor in Education (Electrical And Electronic)(Hons),Bachelor,3 Years,,6518,6400,74086,FEB/JUL/SEP,,"deadline 6th Jan, 9th Jun, 6th Jul",,26
Bachelor in Management (Public Relation & Entertainment)(Hons),Bachelor,3 Years,,6518,6400,62391,FEB/JUL/SEP,,"deadline 6th Jan, 9th Jun, 6th Jul",,26
Bachelor in Information And Communication Technology (Hons),Bachelor,3 Years,,6518,6400,64616,FEB/JUL/SEP,,"deadline 6th Jan, 9th Jun, 6th Jul",,26
Bachelor in Graphic Design (Hons),Bachelor,3 Years,,6518,6400,62486,FEB/JUL/SEP,,"deadline 6th Jan, 9th Jun, 6th Jul",,26
Bachelor in Games Design And Animation (Hons),Bachelor,3 Years,,6518,6400,64676,FEB/JUL/SEP,,"deadline 6th Jan, 9th Jun, 6th Jul",,26
Bachelor in Creative Multimedia (Hons),Bachelor,3 Years,,6518,6400,62456,FEB/JUL/SEP,,"deadline 6th Jan, 9th Jun, 6th Jul",,26
Bachelor in Computer Engineering (Hons),Bachelor,4 Years,,6518,6400,76441,FEB/JUL/SEP,,"deadline 6th Jan, 9th Jun, 6th Jul",,26
Bachelor in Engineering Technology - Electrical And Electronic Engineering (Hons),Bachelor,4 Years,,6518,6400,75916,FEB/JUL/SEP,,"deadline 6th Jan, 9th Jun, 6th Jul",,26
Bachelor in Computer Science (Hons),Bachelor,3 Years,,6518,6400,61346,FEB/JUL/SEP,,"deadline 6th Jan, 9th Jun, 6th Jul",,26
Bachelor in Business Computing (Hons),Bachelor,3 Years,,6518,6400,61346,FEB/JUL/SEP,,"deadline 6th Jan, 9th Jun, 6th Jul",,26
Bachelor in Computer Forensic (Hons),Bachelor,3 Years,,6518,6400,61346,FEB/JUL/SEP,,"deadline 6th Jan, 9th Jun, 6th Jul",,26
Bachelor in Information Technology (Mobile Wireless Technology) (Hons),Bachelor,3 Years,,6518,6400,61346,FEB/JUL/SEP,,"deadline 6th Jan, 9th Jun, 6th Jul",,26
Bachelor in Creative Video And Photography (Hons),Bachelor,3 Years,,6518,6400,63356,FEB/JUL/SEP,,"deadline 6th Jan, 9th Jun, 6th Jul",,26
Bachelor in Instructional Multimedia (Hons),Bachelor,3 Years,,6518,6400,64646,FEB/JUL/SEP,,"deadline 6th Jan, 9th Jun, 6th Jul",,26
Bachelor in New Media (Hons) (Formerly Known As Media Science),Bachelor,3 Years,,6518,6400,62381,FEB/JUL/SEP,,"deadline 6th Jan, 9th Jun, 6th Jul",,26
Bachelor in Visual Communication And Marketing (Hons),Bachelor,3 Years,,6518,6400,64961,FEB/JUL/SEP,,"deadline 6th Jan, 9th Jun, 6th Jul",,26
Bachelor in Information Systems Auditing (Hons),Bachelor,3 Years,,6518,6400,62996,FEB/JUL/SEP,,"deadline 6th Jan, 9th Jun, 6th Jul",,26
Bachelor of Science in Aviation Management And Piloting (Hons),Bachelor,4 Years,,6518,9600,158071,FEB/JUL/SEP,,"deadline 6th Jan, 9th Jun, 6th Jul",,26
Bachelor of Science in Mechanical Engineering (Hons),Bachelor,4 Years,,6518,9600,81131,FEB/JUL/SEP,,"deadline 6th Jan, 9th Jun, 6th Jul",,26
Bachelor of Medicine And Bachelor of Surgery (Mbbs),Bachelor,5 Years,,6518,26600,399875,FEB/JUL/SEP,,"deadline 6th Jan, 9th Jun, 6th Jul",,26
Bachelor in Medical Science (Hons),Bachelor,3 Years,,6518,6400,153396,FEB/JUL/SEP,,"deadline 6th Jan, 9th Jun, 6th Jul",,26
Bachelor in Food Service Technology (Hons),Bachelor,3 Years,,6518,6400,72541,FEB/JUL/SEP,,"deadline 6th Jan, 9th Jun, 6th Jul",,26
Bachelor in Biomedical Science (Hons),Bachelor,3 Years,,6518,6400,162376,FEB/JUL/SEP,,"deadline 6th Jan, 9th Jun, 6th Jul",,26
Bachelor in Bioinformatics (Hons),Bachelor,3 Years,,6518,6400,67361,FEB/JUL/SEP,,"deadline 6th Jan, 9th Jun, 6th Jul",,26
Bachelor in Optometry (Hons),Bachelor,4 Years,,6518,6400,149306,FEB/JUL/SEP,,"deadline 6th Jan, 9th Jun, 6th Jul",,26
Bachelor in Forensic Science (Hons),Bachelor,4 Years,,6518,6400,150971,FEB/JUL/SEP,,"deadline 6th Jan, 9th Jun, 6th Jul",,26
Bachelor in Nutrition (Hons),Bachelor,4 Years,,6518,6400,111131,FEB/JUL/SEP,,"deadline 6th Jan, 9th Jun, 6th Jul",,26
Bachelor in Nursing (Hons),Bachelor,4 Years,,6518,6400,152981,FEB/JUL/SEP,,"deadline 6th Jan, 9th Jun, 6th Jul",,26
Bachelor in Health Science Management (Hons),Bachelor,3.5 Years,,6518,6400,109166,FEB/JUL/SEP,,"deadline 6th Jan, 9th Jun, 6th Jul",,26
Bachelor in Pharmacy (Hons),Bachelor,4 Years,,6518,9600,182216,FEB/JUL/SEP,,"deadline 6th Jan, 9th Jun, 6th Jul",,26
Bachelor in Traditional Chinese Medicine (Hons),Bachelor,4 Years,,6518,9600,147251,FEB/JUL/SEP,,"deadline 6th Jan, 9th Jun, 6th Jul",,26
Bachelor of Science in Pharmaceuticals Technology (Hons),Bachelor,4 Years,,6518,9600,106281,FEB/JUL/SEP,,"deadline 6th Jan, 9th Jun, 6th Jul",,26
Mba,Masters,1.5 Years,,6518,3200,27000,MAR/MAY/NOV,,"deadline 6th Feb, 9th Apr, 6th Oct",,26
Master in Acounting / Finance (By Research),Masters,2 Years,,,,,MAR/MAY/NOV,,"deadline 6th Feb, 9th Apr, 6th Oct",,26
Master in Management (By Research),Masters,2 Years,,,,,MAR/MAY/NOV,,"deadline 6th Feb, 9th Apr, 6th Oct",,26
Master in Computer Science (By Research),Masters,2 Years,,,,,MAR/MAY/NOV,,"deadline 6th Feb, 9th Apr, 6th Oct",,26
Master in Information Technology (By Research),Masters,2 Years,,,,,MAR/MAY/NOV,,"deadline 6th Feb, 9th Apr, 6th Oct",,26
Master of Science Biomedicine (By Research),Masters,2 Years,,,,,MAR/MAY/NOV,,"deadline 6th Feb, 9th Apr, 6th Oct",,26
Master of Science in Food Service Technology (By Research),Masters,2 Years,,,,,MAR/MAY/NOV,,"deadline 6th Feb, 9th Apr, 6th Oct",,26
Master in Pharmacy (By Research),Masters,1 Years,,6518,28350,36750,MAR/MAY/NOV,,"deadline 6th Feb, 9th Apr, 6th Oct",,26
Master in Clinical Pharmacy,Masters,1 Years,,6518,28350,21720,MAR/MAY/NOV,,"deadline 6th Feb, 9th Apr, 6th Oct",,26
Master in Educational Management And Leadership,Masters,2 Years,,6518,4520,41850,MAR/MAY/NOV,,"deadline 6th Feb, 9th Apr, 6th Oct",,26
Master of Science in Engineering (By Research),Masters,1 Years,,6518,18200,10400,MAR/MAY/NOV,,"deadline 6th Feb, 9th Apr, 6th Oct",,26
Phd in Management / Business (By Research),PhD,3 Years,,,,,MAR/MAY/NOV,,"deadline 6th Feb, 9th Apr, 6th Oct",,26
Phd in Accouting / Finance (By Research),PhD,3 Years,,,,,MAR/MAY/NOV,,"deadline 6th Feb, 9th Apr, 6th Oct",,26
Phd in Computer Science (By Research),PhD,3 Years,,,,,MAR/MAY/NOV,,"deadline 6th Feb, 9th Apr, 6th Oct",,26
Phd in Information And Communication Technology (By,PhD,3 Years,,,,,MAR/MAY/NOV,,"deadline 6th Feb, 9th Apr, 6th Oct",,26
Research),PhD,3 Years,,,,,MAR/MAY/NOV,,"deadline 6th Feb, 9th Apr, 6th Oct",,26
Phd in Food Service Technology (By Research),PhD,3 Years,,,,,MAR/MAY/NOV,,"deadline 6th Feb, 9th Apr, 6th Oct",,26
Phd in Biomedicine (By Research),PhD,3 Years,,6518,26000,76600,MAR/MAY/NOV,,"deadline 6th Feb, 9th Apr, 6th Oct",,26
