course,program,duration,nos,emgs,misc,ttf,intake,description,remarks,discount,doc_title,doc_link,uid
Diploma in Accounting,Diploma,2.5 Years ,,2509,3680,38790,FEB/JUL/SEP,,"deadline 6th Jan, 9th Jun, 6th Jul",,,,26
Diploma in Management,Diploma,2.5 Years ,,2509,3680,36900,FEB/JUL/SEP,,"deadline 6th Jan, 9th Jun, 6th Jul",,,,26
Diploma in Investment Management,Diploma,2.5 Years ,,2509,3680,41360,FEB/JUL/SEP,,"deadline 6th Jan, 9th Jun, 6th Jul",,,,26
Diploma in Islamic Finance,Diploma,2.5 Years ,,2509,3680,41310,FEB/JUL/SEP,,"deadline 6th Jan, 9th Jun, 6th Jul",,,,26
Diploma in Islamic Banking,Diploma,2.5 Years ,,2509,3680,44550,FEB/JUL/SEP,,"deadline 6th Jan, 9th Jun, 6th Jul",,,,26
Diploma in Human Capital Management,Diploma,2.5 Years ,,2509,3680,40320,FEB/JUL/SEP,,"deadline 6th Jan, 9th Jun, 6th Jul",,,,26
Diploma in Retail Management,Diploma,2.5 Years ,,2509,3680,37350,FEB/JUL/SEP,,"deadline 6th Jan, 9th Jun, 6th Jul",,,,26
Diploma in Logistic Management,Diploma,2.5 Years ,,2509,3680,44550,FEB/JUL/SEP,,"deadline 6th Jan, 9th Jun, 6th Jul",,,,26
Diploma in Entrepreneurship,Diploma,2.5 Years ,,2509,3680,41310,FEB/JUL/SEP,,"deadline 6th Jan, 9th Jun, 6th Jul",,,,26
Diploma in Office Management Technology,Diploma,2.5 Years ,,2509,3680,41310,FEB/JUL/SEP,,"deadline 6th Jan, 9th Jun, 6th Jul",,,,26
Diploma in Music Technology,Diploma,2.5 Years ,,2509,3680,53010,FEB/JUL/SEP,,"deadline 6th Jan, 9th Jun, 6th Jul",,,,26
Diploma in Beauty Management,Diploma,2.5 Years ,,2509,3680,41040,FEB/JUL/SEP,,"deadline 6th Jan, 9th Jun, 6th Jul",,,,26
Diploma in Hair Dressing,Diploma,2.5 Years ,,2509,3680,41040,FEB/JUL/SEP,,"deadline 6th Jan, 9th Jun, 6th Jul",,,,26
Diploma in Spa Management,Diploma,2.5 Years ,,2509,3680,41130,FEB/JUL/SEP,,"deadline 6th Jan, 9th Jun, 6th Jul",,,,26
"Diploma in Leisure, Outdoor And Adventure Management",Diploma,2.5 Years ,,2509,3680,38880,FEB/JUL/SEP,,"deadline 6th Jan, 9th Jun, 6th Jul",,,,26
Diploma in Culinary Arts,Diploma,2.5 Years ,,2509,3680,41010,FEB/JUL/SEP,,"deadline 6th Jan, 9th Jun, 6th Jul",,,,26
Diploma in Event Management,Diploma,2.5 Years ,,2509,3680,41310,FEB/JUL/SEP,,"deadline 6th Jan, 9th Jun, 6th Jul",,,,26
Diploma in Fashion Design,Diploma,2.5 Years ,,2509,3680,41220,FEB/JUL/SEP,,"deadline 6th Jan, 9th Jun, 6th Jul",,,,26
Diploma in Hospitality Management - Tourism,Diploma,2.5 Years ,,2509,3680,41220,FEB/JUL/SEP,,"deadline 6th Jan, 9th Jun, 6th Jul",,,,26
Diploma in Pattiserrie Arts,Diploma,2.5 Years ,,2509,3680,54000,FEB/JUL/SEP,,"deadline 6th Jan, 9th Jun, 6th Jul",,,,26
Diploma in Music ,Diploma,2.5 Years ,,2509,3680,49050,FEB/JUL/SEP,,"deadline 6th Jan, 9th Jun, 6th Jul",,,,26
Diploma in Counseling And Guidance,Diploma,2.5 Years ,,2509,3680,37890,FEB/JUL/SEP,,"deadline 6th Jan, 9th Jun, 6th Jul",,,,26
Diploma in Education - Tesl,Diploma,2.5 Years ,,2509,3680,42330,FEB/JUL/SEP,,"deadline 6th Jan, 9th Jun, 6th Jul",,,,26
Diploma in Early Childhood Education,Diploma,2.5 Years ,,2509,3680,40410,FEB/JUL/SEP,,"deadline 6th Jan, 9th Jun, 6th Jul",,,,26
Diploma in Management (Public Relations & Entertainment),Diploma,2.5 Years ,,2509,3680,41310,FEB/JUL/SEP,,"deadline 6th Jan, 9th Jun, 6th Jul",,,,26
Diploma in Translation and Interpretation,Diploma,2.5 Years ,,2509,3680,42030,FEB/JUL/SEP,,"deadline 6th Jan, 9th Jun, 6th Jul",,,,26
Diploma in Aircraft Maintenance Technology,Diploma,3 Years,,2509,3680,82980,FEB/JUL/SEP,,"deadline 6th Jan, 9th Jun, 6th Jul",,,,26
Diploma in Computer Engineering,Diploma,2.5 Years ,,2509,3680,42310,FEB/JUL/SEP,,"deadline 6th Jan, 9th Jun, 6th Jul",,,,26
Diploma in Computer Forensic,Diploma,2.5 Years ,,2509,3680,40950,FEB/JUL/SEP,,"deadline 6th Jan, 9th Jun, 6th Jul",,,,26
Diploma in Electrical And Electronic Engineering,Diploma,2.5 Years ,,2509,3680,38880,FEB/JUL/SEP,,"deadline 6th Jan, 9th Jun, 6th Jul",,,,26
Diloma in Mechanical Engineering,Diploma,2.5 Years ,,2509,3680,88020,FEB/JUL/SEP,,"deadline 6th Jan, 9th Jun, 6th Jul",,,,26
Diploma in Mechanical Engineering (Air Conditioning & Refrigeration),Diploma,2.5 Years ,,2509,3680,83160,FEB/JUL/SEP,,"deadline 6th Jan, 9th Jun, 6th Jul",,,,26
Diploma in Mechanical Engineering (Highrise Building Maintenance),Diploma,2.5 Years ,,2509,3680,82740,FEB/JUL/SEP,,"deadline 6th Jan, 9th Jun, 6th Jul",,,,26
Diploma in Business Computing,Diploma,2.5 Years ,,2509,3680,41310,FEB/JUL/SEP,,"deadline 6th Jan, 9th Jun, 6th Jul",,,,26
Diploma in Games Design And Animation,Diploma,2.5 Years ,,2509,3680,41310,FEB/JUL/SEP,,"deadline 6th Jan, 9th Jun, 6th Jul",,,,26
Diploma in Graphic Design,Diploma,2.5 Years ,,2509,3680,41310,FEB/JUL/SEP,,"deadline 6th Jan, 9th Jun, 6th Jul",,,,26
Diploma in Information Technology,Diploma,2.5 Years ,,2509,3680,37890,FEB/JUL/SEP,,"deadline 6th Jan, 9th Jun, 6th Jul",,,,26
Diploma in Multimedia,Diploma,2.5 Years ,,2509,3680,40320,FEB/JUL/SEP,,"deadline 6th Jan, 9th Jun, 6th Jul",,,,26
Diploma in Mobile wireless Technonogy,Diploma,2.5 Years ,,2509,3680,41310,FEB/JUL/SEP,,"deadline 6th Jan, 9th Jun, 6th Jul",,,,26
Diploma in Creative Visual,Diploma,2.5 Years ,,2509,3680,57960,FEB/JUL/SEP,,"deadline 6th Jan, 9th Jun, 6th Jul",,,,26
Diploma in Interior Design,Diploma,2.5 Years ,,2509,3680,57960,FEB/JUL/SEP,,"deadline 6th Jan, 9th Jun, 6th Jul",,,,26
diploma in information management,Diploma,2.5 Years ,,2509,3680,38880,FEB/JUL/SEP,,"deadline 6th Jan, 9th Jun, 6th Jul",,,,26
Diploma in Medical Science,Diploma,3.5 Years ,,2509,3680,63390,FEB/JUL/SEP,,"deadline 6th Jan, 9th Jun, 6th Jul",,,,26
Diploma in Medical Laboratory Technology,Diploma,3 Years,,2509,3680,63390,FEB/JUL/SEP,,"deadline 6th Jan, 9th Jun, 6th Jul",,,,26
Diploma in Occupational Safety And Health,Diploma,3 Years,,2509,3680,69010,FEB/JUL/SEP,,"deadline 6th Jan, 9th Jun, 6th Jul",,,,26
Diploma in Radiotherapy,Diploma,3 Years,,2509,3680,86720,FEB/JUL/SEP,,"deadline 6th Jan, 9th Jun, 6th Jul",,,,26
Diploma in Medical Assistant,Diploma,3 Years,,2509,3680,63340,FEB/JUL/SEP,,"deadline 6th Jan, 9th Jun, 6th Jul",,,,26
Diploma in Nursing,Diploma,3 Years,,2509,3680,99300,FEB/JUL/SEP,,"deadline 6th Jan, 9th Jun, 6th Jul",,,,26
Diploma in Physiotherapy,Diploma,3 Years,,2509,3680,84880,FEB/JUL/SEP,,"deadline 6th Jan, 9th Jun, 6th Jul",,,,26
Diploma in Sport Science,Diploma,2.5 Years ,,2509,3680,41310,FEB/JUL/SEP,,"deadline 6th Jan, 9th Jun, 6th Jul",,,,26
Diploma in Ophtalmic Dispensing,Diploma,3 Years,,2509,3680,73800,FEB/JUL/SEP,,"deadline 6th Jan, 9th Jun, 6th Jul",,,,26
Diploma in Traditional Chinese Medicine,Diploma,2.5 Years ,,2509,3680,77540,FEB/JUL/SEP,,"deadline 6th Jan, 9th Jun, 6th Jul",,,,26
Diploma in Pharmacy,Diploma,2.5 Years ,,2509,3680,57560,FEB/JUL/SEP,,"deadline 6th Jan, 9th Jun, 6th Jul",,,,26
Foundation in Science (Biological Science / Health Science),Foundation,1 Year,,2509,4210,20160,FEB/JUL/SEP,,"deadline 6th Jan, 9th Jun, 6th Jul",,,,26
Foundation in Business,Foundation,1 Year,,2509,4210,18650,FEB/JUL/SEP,,"deadline 6th Jan, 9th Jun, 6th Jul",,,,26
Foundation in Law,Foundation,1 Year,,2509,4210,18650,FEB/JUL/SEP,,"deadline 6th Jan, 9th Jun, 6th Jul",,,,26
Foundation in Information Technology,Foundation,1 Year,,2509,4210,18650,FEB/JUL/SEP,,"deadline 6th Jan, 9th Jun, 6th Jul",,,,26
Foundation in Engineering And Technology,Foundation,1 Year,,2509,4210,18650,FEB/JUL/SEP,,"deadline 6th Jan, 9th Jun, 6th Jul",,,,26
Foundation in Visual Arts,Foundation,1 Year,,2509,4210,20150,FEB/JUL/SEP,,"deadline 6th Jan, 9th Jun, 6th Jul",,,,26
Foundation in Tesl,Foundation,1 Year,,2509,4210,18650,FEB/JUL/SEP,,"deadline 6th Jan, 9th Jun, 6th Jul",,,,26
Bachelor in International Business (Hons),Bachelor,3 Years,,2509,4010,67995,FEB/JUL/SEP,,"deadline 6th Jan, 9th Jun, 6th Jul",,,,26
Bachelor in Industrial Management (Hons),Bachelor,3 Years,,2509,4010,60705,FEB/JUL/SEP,,"deadline 6th Jan, 9th Jun, 6th Jul",,,,26
Bachelor in Law And Commerce (Hons),Bachelor,3 Years,,2509,4010,67935,FEB/JUL/SEP,,"deadline 6th Jan, 9th Jun, 6th Jul",,,,26
Bachelor in Human Capital Management (Hons),Bachelor,3 Years,,2509,4010,65115,FEB/JUL/SEP,,"deadline 6th Jan, 9th Jun, 6th Jul",,,,26
Bachelor in Accounting (Hons),Bachelor,4 Years,,2509,4010,77040,FEB/JUL/SEP,,"deadline 6th Jan, 9th Jun, 6th Jul",,,,26
Bachelor in Investment Management (Hons),Bachelor,3 Years,,2509,4010,65115,FEB/JUL/SEP,,"deadline 6th Jan, 9th Jun, 6th Jul",,,,26
Bachelor in Islamic Management (Hons),Bachelor,3 Years,,2509,4010,69330,FEB/JUL/SEP,,"deadline 6th Jan, 9th Jun, 6th Jul",,,,26
Bachelor in Finance (Hons),Bachelor,3 Years,,2509,4010,67770,FEB/JUL/SEP,,"deadline 6th Jan, 9th Jun, 6th Jul",,,,26
Bachelor in Marketing With Psychology (Hons),Bachelor,3 Years,,2509,4010,61650,FEB/JUL/SEP,,"deadline 6th Jan, 9th Jun, 6th Jul",,,,26
Bachelor in Retail Management (Hons),Bachelor,3 Years,,2509,4010,57900,FEB/JUL/SEP,,"deadline 6th Jan, 9th Jun, 6th Jul",,,,26
Bachelor in Takaful (Hons),Bachelor,3 Years,,2509,4010,77010,FEB/JUL/SEP,,"deadline 6th Jan, 9th Jun, 6th Jul",,,,26
Bachelor in Islamic Finance (Hons),Bachelor,3 Years,,2509,4010,77010,FEB/JUL/SEP,,"deadline 6th Jan, 9th Jun, 6th Jul",,,,26
Bachelor in Islamic Banking (Hons),Bachelor,3 Years,,2509,4010,77010,FEB/JUL/SEP,,"deadline 6th Jan, 9th Jun, 6th Jul",,,,26
Bachelor in Enterprenuership (Hons),Bachelor,3.5 Years,,2509,4010,77000,FEB/JUL/SEP,,"deadline 6th Jan, 9th Jun, 6th Jul",,,,26
Bachelor in Office management Technology (Hons),Bachelor,3.5 Years,,2509,4010,63735,FEB/JUL/SEP,,"deadline 6th Jan, 9th Jun, 6th Jul",,,,26
Bachelor in Logistics management (Hons),Bachelor,3 Years,,2509,4010,77010,FEB/JUL/SEP,,"deadline 6th Jan, 9th Jun, 6th Jul",,,,26
Bachelor in Accounting and Finance (Hons),Bachelor,4 Years,,2509,4010,85000,FEB/JUL/SEP,,"deadline 6th Jan, 9th Jun, 6th Jul",,,,26
Bachelor in Hospitality Management - Tourism (Hons),Bachelor,3.5 Years,,2509,4010,70000,FEB/JUL/SEP,,"deadline 6th Jan, 9th Jun, 6th Jul",,,,26
Bachelor in Event Management (Hons),Bachelor,3 Years,,2509,4010,65940,FEB/JUL/SEP,,"deadline 6th Jan, 9th Jun, 6th Jul",,,,26
Bachelor in Culinary Arts (Hons),Bachelor,3 Years,,2509,4010,68460,FEB/JUL/SEP,,"deadline 6th Jan, 9th Jun, 6th Jul",,,,26
Bachelor in Fashion Design With Marketing(Hons),Bachelor,3 Years,,2509,4010,68460,FEB/JUL/SEP,,"deadline 6th Jan, 9th Jun, 6th Jul",,,,26
"Bachelor in Leisure, Outdoor And Adventure Maangement (Hons)",Bachelor,3 Years,,2509,4010,65940,FEB/JUL/SEP,,"deadline 6th Jan, 9th Jun, 6th Jul",,,,26
Bachelor in Spa Management (Hons),Bachelor,3 Years,,2509,4010,68460,FEB/JUL/SEP,,"deadline 6th Jan, 9th Jun, 6th Jul",,,,26
Bachelor in Music Technology (Hons),Bachelor,3 Years,,2509,4010,95580,FEB/JUL/SEP,,"deadline 6th Jan, 9th Jun, 6th Jul",,,,26
Bachelor in Accessories Design (Hons),Bachelor,3 Years,,2509,4010,77960,FEB/JUL/SEP,,"deadline 6th Jan, 9th Jun, 6th Jul",,,,26
Bachelor in Pattsserie Arts (Hons),Bachelor,3 Years,,2509,4010,77960,FEB/JUL/SEP,,"deadline 6th Jan, 9th Jun, 6th Jul",,,,26
Bachelor in Beauty And Hair Management (Hons),Bachelor,3 Years,,2509,4010,71960,FEB/JUL/SEP,,"deadline 6th Jan, 9th Jun, 6th Jul",,,,26
Bachelor in Music (Cimposition & Arranging) ( Hons),Bachelor,3.5 Years,,2509,4010,86460,FEB/JUL/SEP,,"deadline 6th Jan, 9th Jun, 6th Jul",,,,26
Bachelor in Music performance ( Hons),Bachelor,3.5 Years,,2509,4010,86460,FEB/JUL/SEP,,"deadline 6th Jan, 9th Jun, 6th Jul",,,,26
Bachelor in Education - Tesl (Hons),Bachelor,3 Years,,2509,4010,68460,FEB/JUL/SEP,,"deadline 6th Jan, 9th Jun, 6th Jul",,,,26
Bachelor in Early Childhood Education (Hons),Bachelor,3 Years,,2509,4010,68460,FEB/JUL/SEP,,"deadline 6th Jan, 9th Jun, 6th Jul",,,,26
Bachelor in Counseling And Guidance (Hons),Bachelor,4 Years,,2509,4010,68460,FEB/JUL/SEP,,"deadline 6th Jan, 9th Jun, 6th Jul",,,,26
Bachelor in Education (Visual Arts)(Hons),Bachelor,3 Years,,2509,4010,68460,FEB/JUL/SEP,,"deadline 6th Jan, 9th Jun, 6th Jul",,,,26
Bachelor in Education (Science) (Hons),Bachelor,3 Years,,2509,4010,68460,FEB/JUL/SEP,,"deadline 6th Jan, 9th Jun, 6th Jul",,,,26
Bachelor in Education (Physical Education And Health)(Hons),Bachelor,3 Years,,2509,4010,64095,FEB/JUL/SEP,,"deadline 6th Jan, 9th Jun, 6th Jul",,,,26
Bachelor in Education (Electrical And Electronic)(Hons),Bachelor,3 Years,,2509,4010,83160,FEB/JUL/SEP,,"deadline 6th Jan, 9th Jun, 6th Jul",,,,26
Bachelor in Management (Public Relation & Entertainment)(Hons),Bachelor,3 Years,,2509,4010,68460,FEB/JUL/SEP,,"deadline 6th Jan, 9th Jun, 6th Jul",,,,26
Bachelor in Psychology (Hons),Bachelor,3 Years,,2509,4010,83460,FEB/JUL/SEP,,"deadline 6th Jan, 9th Jun, 6th Jul",,,,26
Bachelor in English Language & Literature Studies ( Hons),Bachelor,3 Years,,2509,4010,75645,FEB/JUL/SEP,,"deadline 6th Jan, 9th Jun, 6th Jul",,,,26
Bachelor in Broadcasting (Hons),Bachelor,3 Years,,2509,4010,80000,FEB/JUL/SEP,,"deadline 6th Jan, 9th Jun, 6th Jul",,,,26
Bachelor in Information And Communication Technology (Hons),Bachelor,3 Years,,2509,4010,62745,FEB/JUL/SEP,,"deadline 6th Jan, 9th Jun, 6th Jul",,,,26
Bachelor in Graphic Design (Hons),Bachelor,3 Years,,2509,4010,64470,FEB/JUL/SEP,,"deadline 6th Jan, 9th Jun, 6th Jul",,,,26
Bachelor in Games Design And Animation (Hons),Bachelor,3 Years,,2509,4010,68460,FEB/JUL/SEP,,"deadline 6th Jan, 9th Jun, 6th Jul",,,,26
Bachelor in Creative Multimedia (Hons),Bachelor,3 Years,,2509,4010,68460,FEB/JUL/SEP,,"deadline 6th Jan, 9th Jun, 6th Jul",,,,26
Bachelor in Computer Engineering (Hons),Bachelor,4 Years,,2509,4010,76800,FEB/JUL/SEP,,"deadline 6th Jan, 9th Jun, 6th Jul",,,,26
Bachelor in Engineering Technology - Electrical And Electronic Engineering (Hons),Bachelor,4 Years,,2509,4010,76000,FEB/JUL/SEP,,"deadline 6th Jan, 9th Jun, 6th Jul",,,,26
Bachelor in Computer Science (Hons),Bachelor,3 Years,,2509,4010,67110,FEB/JUL/SEP,,"deadline 6th Jan, 9th Jun, 6th Jul",,,,26
Bachelor in Business Computing (Hons),Bachelor,3 Years,,2509,4010,68460,FEB/JUL/SEP,,"deadline 6th Jan, 9th Jun, 6th Jul",,,,26
Bachelor in Computer Forensic (Hons),Bachelor,3 Years,,2509,4010,66000,FEB/JUL/SEP,,"deadline 6th Jan, 9th Jun, 6th Jul",,,,26
Bachelor in Information Technology (Mobile Wireless Technology) (Hons),Bachelor,3 Years,,2509,4010,68460,FEB/JUL/SEP,,"deadline 6th Jan, 9th Jun, 6th Jul",,,,26
Bachelor in Creative Video And Photography (Hons),Bachelor,3 Years,,2509,4010,68460,FEB/JUL/SEP,,"deadline 6th Jan, 9th Jun, 6th Jul",,,,26
Bachelor in Instructional Multimedia (Hons),Bachelor,3 Years,,2509,4010,67185,FEB/JUL/SEP,,"deadline 6th Jan, 9th Jun, 6th Jul",,,,26
Bachelor in New Media (Hons) (Formerly Known As Media Science),Bachelor,3 Years,,2509,4010,67500,FEB/JUL/SEP,,"deadline 6th Jan, 9th Jun, 6th Jul",,,,26
Bachelor in Visual Communication And Marketing (Hons),Bachelor,3 Years,,2509,4010,61620,FEB/JUL/SEP,,"deadline 6th Jan, 9th Jun, 6th Jul",,,,26
Bachelor in Information Systems Auditing (Hons),Bachelor,3 Years,,2509,4010,68460,FEB/JUL/SEP,,"deadline 6th Jan, 9th Jun, 6th Jul",,,,26
Bachelor of Science in Aviation Management And Piloting (Hons),Bachelor,4 Years,,2509,4010,165550,FEB/JUL/SEP,,"deadline 6th Jan, 9th Jun, 6th Jul",,,,26
Bachelor of Science in Mechanical Engineering (Hons),Bachelor,4 Years,,2509,4010,87540,FEB/JUL/SEP,,"deadline 6th Jan, 9th Jun, 6th Jul",,,,26
Bachelor of Product Design (Hons),Bachelor,3 Years,,2509,4010,106920,FEB/JUL/SEP,,"deadline 6th Jan, 9th Jun, 6th Jul",,,,26
Bachelor of Medicine And Bachelor of Surgery (Mbbs),Bachelor,5 Years,,2509,7210,468000,FEB/JUL/SEP,,"deadline 6th Jan, 9th Jun, 6th Jul",,,,26
Bachelor in Medical Science (Hons),Bachelor,3 Years,,2509,4010,155400,FEB/JUL/SEP,,"deadline 6th Jan, 9th Jun, 6th Jul",,,,26
Bachelor in Food Service Technology (Hons),Bachelor,3 Years,,2509,4010,78560,FEB/JUL/SEP,,"deadline 6th Jan, 9th Jun, 6th Jul",,,,26
Bachelor in Biomedical Science (Hons),Bachelor,4 Years,,2509,4010,165460,FEB/JUL/SEP,,"deadline 6th Jan, 9th Jun, 6th Jul",,,,26
Bachelor in Bioinformatics (Hons),Bachelor,3 Years,,2509,4010,75600,FEB/JUL/SEP,,"deadline 6th Jan, 9th Jun, 6th Jul",,,,26
Bachelor in Optometry (Hons),Bachelor,4 Years,,2509,4010,155440,FEB/JUL/SEP,,"deadline 6th Jan, 9th Jun, 6th Jul",,,,26
Bachelor in Forensic Science (Hons),Bachelor,4 Years,,2509,4010,155460,FEB/JUL/SEP,,"deadline 6th Jan, 9th Jun, 6th Jul",,,,26
Bachelor in Nutrition (Hons),Bachelor,4 Years,,2509,4010,109080,FEB/JUL/SEP,,"deadline 6th Jan, 9th Jun, 6th Jul",,,,26
Bachelor in Nursing (Hons),Bachelor,4 Years,,2509,4010,155460,FEB/JUL/SEP,,"deadline 6th Jan, 9th Jun, 6th Jul",,,,26
Bachelor in Health Science Management (Hons),Bachelor,3.5 Years,,2509,4010,115430,FEB/JUL/SEP,,"deadline 6th Jan, 9th Jun, 6th Jul",,,,26
Bachelor in Cardiovascular Technology (Hons),Bachelor,4 Years,,2509,4010,165440,FEB/JUL/SEP,,"deadline 6th Jan, 9th Jun, 6th Jul",,,,26
Bachelor in Environmental Health ( Hons),Bachelor,4 Years,,2509,4010,93600,FEB/JUL/SEP,,"deadline 6th Jan, 9th Jun, 6th Jul",,,,26
bachelor in Halal Quality Assurance (Hons),Bachelor,3.5Years,,2509,4010,82000,FEB/JUL/SEP,,"deadline 6th Jan, 9th Jun, 6th Jul",,,,26
Bachelor in Pharmacy (Hons),Bachelor,4 Years,,2509,4010,182100,FEB/JUL/SEP,,"deadline 6th Jan, 9th Jun, 6th Jul",,,,26
Bachelor in Traditional Chinese Medicine (Hons),Bachelor,4 Years,,2509,4010,155430,FEB/JUL/SEP,,"deadline 6th Jan, 9th Jun, 6th Jul",,,,26
Bachelor of Science in Pharmaceuticals Technology (Hons),Bachelor,4 Years,,2509,4010,116165,FEB/JUL/SEP,,"deadline 6th Jan, 9th Jun, 6th Jul",,,,26
Mba,Masters,1.5 Years,,2509,4010,27000,MAR/MAY/NOV,,"deadline 6th Feb, 9th Apr, 6th Oct",,,,26
Master in Acounting / Finance (By Research),Masters,1 Years,,3056,5172,16560,MAR/MAY/NOV,,"deadline 6th Feb, 9th Apr, 6th Oct",,,,26
Master in Management (By Research),Masters,1 Years,,3056,5172,16560,MAR/MAY/NOV,,"deadline 6th Feb, 9th Apr, 6th Oct",,,,26
Master in Education ( Teaching English a Second Language) (Course work),Masters,1 Years,,2896,5172,48800,MAR/MAY/NOV,,"deadline 6th Feb, 9th Apr, 6th Oct",,,,26
Master in Educational Management And Leadership ( Coursework),Masters,2 Years,,2896,5172,47600,MAR/MAY/NOV,,"deadline 6th Feb, 9th Apr, 6th Oct",,,,26
master in Fashion Business (By Coursework),Masters,1 Years,,2896,5172,53200,MAR/MAY/NOV,,"deadline 6th Feb, 9th Apr, 6th Oct",,,,26
Master In International Business (coursework),Masters,1.5 Years,,2896,5172,53200,MAR/MAY/NOV,,"deadline 6th Feb, 9th Apr, 6th Oct",,,,26
Master in International Hospitality and Tourism ( By Coursework),Masters,1.5 Years,,2896,5172,66800,MAR/MAY/NOV,,"deadline 6th Feb, 9th Apr, 6th Oct",,,,26
master in Counseling and Guidancy (Coursework),Masters,1.5 Years,,2896,5172,48800,MAR/MAY/NOV,,"deadline 6th Feb, 9th Apr, 6th Oct",,,,26
Master in Computer Science (By Research),Masters,2 Years,,3056,5172,20000,MAR/MAY/NOV,,"deadline 6th Feb, 9th Apr, 6th Oct",,,,26
Master in Information Technology (By Research),Masters,1 Years,,3056,5172,20000,MAR/MAY/NOV,,"deadline 6th Feb, 9th Apr, 6th Oct",,,,26
Master of Science Biomedicine (By Research),Masters,2 Years,,3056,5172,23460,MAR/MAY/NOV,,"deadline 6th Feb, 9th Apr, 6th Oct",,,,26
Master in Biomedicine Science (By Coursework),Masters,1.3 Years,,3056,5172,69600,MAR/MAY/NOV,,"deadline 6th Feb, 9th Apr, 6th Oct",,,,26
Master of Science in Food Service Technology (By Research),Masters,2 Years,,3056,5172,23460,MAR/MAY/NOV,,"deadline 6th Feb, 9th Apr, 6th Oct",,,,26
Master of Science (Applied Science)( Research),Masters,2 Years,,3056,5172,35600,MAR/MAY/NOV,,"deadline 6th Feb, 9th Apr, 6th Oct",,,,26
Master of Design ( By Research),Masters,3 Years,,2896,4756,58000,MAR/MAY/NOV,,"deadline 6th Feb, 9th Apr, 6th Oct",,,,26
Master in Pharmacy (By Research),Masters,1 Years,,3056,5172,57200,MAR/MAY/NOV,,"deadline 6th Feb, 9th Apr, 6th Oct",,,,26
Master in Clinical Pharmacy,Masters,1 Years,,2896,5912,54400,MAR/MAY/NOV,,"deadline 6th Feb, 9th Apr, 6th Oct",,,,26
Master of Science (Medical Physiology)( Coursework),Masters,2 Years,,2896,5912,69600,MAR/MAY/NOV,,"deadline 6th Feb, 9th Apr, 6th Oct",,,,26
Master of Science in Engineering (By Research),Masters,1 Years,,3056,5912,20800,MAR/MAY/NOV,,"deadline 6th Feb, 9th Apr, 6th Oct",,,,26
Phd in Management / Business (By Research),PhD,3 Years,,3056,5912,31040,MAR/MAY/NOV,,"deadline 6th Feb, 9th Apr, 6th Oct",,,,26
Phd in Accouting / Finance (By Research),PhD,3 Years,,3056,5912,31040,MAR/MAY/NOV,,"deadline 6th Feb, 9th Apr, 6th Oct",,,,26
Phd in Computer Science (By Research),PhD,3 Years,,3056,5912,36560,MAR/MAY/NOV,,"deadline 6th Feb, 9th Apr, 6th Oct",,,,26
Phd in Information And Communication Technology (By Research),PhD,3 Years,,3056,5912,36560,MAR/MAY/NOV,,"deadline 6th Feb, 9th Apr, 6th Oct",,,,26
 Phd  of Philosophy in engineering ( By Research),PhD,4 Years,,3056,5912,88000,MAR/MAY/NOV,,"deadline 6th Feb, 9th Apr, 6th Oct",,,,26
Phd in Food Service Technology (By Research),PhD,3 Years,,3056,5912,42080,MAR/MAY/NOV,,"deadline 6th Feb, 9th Apr, 6th Oct",,,,26
Phd in Biomedicine (By Research),PhD,3 Years,,3056,5912,42080,MAR/MAY/NOV,,"deadline 6th Feb, 9th Apr, 6th Oct",,,,26
