course,program,duration,nos,emgs,misc,ttf,intake,description,remarks,discount,doc_title,doc_link,uid
Foundation in Engineering for Spanish Universities,Foundation,1 Year,2,2200,6200,,May,,,,,,43
Foundation in Pre-France University,Foundation,1.5 Years,3,2200,6200,,May,,,,,,43
Foundation in Science and Technology,Foundation,1 Years,3,2200,6200,18000,May,,,,,,43
Foundation in Computer Technology,Foundation,,3,2200,6200,19500,June,,,,,,43
Science and Technology for Korean Universities,Foundation,1 Year,2,2200,6200,,June,,,,,,43
Science and Technology,Foundation,1.5 Years,3,2200,6200,,May,,,,,,43
Foundation in Medical Science,Foundation,1 Year,,2200,6200,25000,,,,,,,43
Foundation in Business ,Foundation,1 Year,2,2200,6200,17000,June,,,,,,43
Foundation in Science,Foundation,1 Year,2,2200,6200,,July,,,,,,43
Foundation for Korean University (self-sponsored),Foundation,1.5 Years,3,2200,6200,,May,,,,,,43
Pre- Russian University Engineering Program,Foundation,1 Year,2,2200,6200,,may,,,,,,43
Diploma in IT,Diploma,3 Years,6,2200,6200,35100,Jan/Jun/July/Sep,,,,,,43
Diploma in Mltimedia,Diploma,3 Years,6,2200,6200,35100,Jan/Jun/July/Sep,,,,,,43
Diploma in computer & networking,Diploma,3 Years,6,2200,6200,42300,Jan/Jun/July/Sep,,,,,,43
Diploma in animation,Diploma,3 Years,6,2200,6200,50700,Jan/Jun/July/Sep,,,,,,43
Diploma in computing,Diploma,3 Years,6,2200,6200,42300,Jan/Jun/July/Sep,,,,,,43
Diploma in Engineering Technology Electrical & Electronics,Diploma,3 Years,6,2200,6200,42300,Jan/Jun/July/Sep,,,,,,43
Diploma in medical electonics,Diploma,3 Years,6,2200,6200,42300,Jan/Jun/July/Sep,,,,,,43
Diploma in talecommunication ,Diploma,3 Years,6,2200,6200,42300,Jan/Jun/July/Sep,,,,,,43
Diploma in biomedical lab science ,Diploma,3 Years,6,2200,6200,44100,Jan/Jun/July/Sep,,,,,,43
Diploma in Environmental health science ,Diploma,3 Years,6,2200,6200,44100,Jan/Jun/July/Sep,,,,,,43
Diploma in medical Laboratory Technology,Diploma,3 Years,6,2200,6200,44100,Jan/Jun/July/Sep,,,,,,43
Diploma in automated system maintenance ,Diploma,3 Years,6,2200,6200,42300,Jan/Jun/July/Sep,,,,,,43
Diploma in electrical equipment & installation ,Diploma,3 Years,6,2200,6200,42300,Jan/Jun/July/Sep,,,,,,43
Diploma in Machine building & maintenance ,Diploma,3 Years,6,2200,6200,42300,Jan/Jun/July/Sep,,,,,,43
Diploma in Airconditioning & refrigeration ,Diploma,3 Years,6,2200,6200,46200,Jan/Jun/July/Sep,,,,,,43
Diploma in Metal febrication ,Diploma,3 Years,6,2200,6200,42300,Jan/Jun/July/Sep,,,,,,43
Diploma in welding ,Diploma,3 Years,6,2200,6200,44700,Jan/Jun/July/Sep,,,,,,43
Diploma in Automotive maintenance ,Diploma,3 Years,6,2200,6200,46200,Jan/Jun/July/Sep,,,,,,43
Diploma in aircraft [avionics],Diploma,3 Years,6,2200,6200,50700,Jan/Jun/July/Sep,,,,,,43
Diploma in aircraft [Composites],Diploma,3 Years,6,2200,6200,50700,Jan/Jun/July/Sep,,,,,,43
Diploma in aircraft [Manufacturing],Diploma,3 Years,6,2200,6200,50700,Jan/Jun/July/Sep,,,,,,43
Diploma in Avionics maintenance,Diploma,3 Years,6,2200,6200,50700,Jan/Jun/July/Sep,,,,,,43
Diploma in Helicoptar Maintenance ,Diploma,3 Years,6,2200,6200,50700,Jan/Jun/July/Sep,,,,,,43
Diploma In Aeroplane Maintenance ,Diploma,3 Years,6,2200,6200,50700,Jan/Jun/July/Sep,,,,,,43
Diploma in Chemical Engineering [Bio-process],Diploma,3 Years,6,2200,6200,44700,Jan/Jun/July/Sep,,,,,,43
Diploma in Chemical Engineering [process],Diploma,3 Years,6,2200,6200,44700,Jan/Jun/July/Sep,,,,,,43
Diploma in Chemical Engineering [Environmental],Diploma,3 Years,6,2200,6200,44700,Jan/Jun/July/Sep,,,,,,43
Diploma in Chemical [Food],Diploma,3 Years,6,2200,6200,44700,Jan/Jun/July/Sep,,,,,,43
Diploma in Chemical [Polymer],Diploma,3 Years,6,2200,6200,44700,Jan/Jun/July/Sep,,,,,,43
Diploma in Ship Design ,Diploma,3 Years,6,2200,6200,46800,Jan/Jun/July/Sep,,,,,,43
Diploma in Ship Maintenance & Construction,Diploma,3 Years,6,2200,6200,46800,Jan/Jun/July/Sep,,,,,,43
Diploma in Marine ,Diploma,3 Years,6,2200,6200,50700,Jan/Jun/July/Sep,,,,,,43
Diploma in Marine electrical & electronics ,Diploma,3 Years,6,2200,6200,46800,Jan/Jun/July/Sep,,,,,,43
Diploma in Mechanical Design & Development,Diploma,3 Years,6,2200,6200,42300,Jan/Jun/July/Sep,,,,,,43
Diploma in Mould Manufacturing ,Diploma,3 Years,6,2200,6200,42300,Jan/Jun/July/Sep,,,,,,43
Diploma in Production Engineering ,Diploma,3 Years,6,2200,6200,42300,Jan/Jun/July/Sep,,,,,,43
Diploma in Automated regulation & Control,Diploma,3 Years,6,2200,6200,42300,Jan/Jun/July/Sep,,,,,,43
Diploma in Elecromechanical installation & Maintenance ,Diploma,3 Years,6,2200,6200,42300,Jan/Jun/July/Sep,,,,,,43
Diploma in Quality Engineering ,Diploma,3 Years,6,2200,6200,44100,Jan/Jun/July/Sep,,,,,,43
Diploma in industrial logistics ,Diploma,3 Years,6,2200,6200,44100,Jan/Jun/July/Sep,,,,,,43
Diploma in pharmacy,Diploma,3 Years,6,2200,6200,50700,Jan/Jun/July/Sep,,,,,,43
Diploma in Nursing ,Diploma,3 Years,6,2200,6200,51600,Jan/Jun/July/Sep,,,,,,43
Diploma in Radiography ,Diploma,3 Years,6,2200,6200,50700,Jan/Jun/July/Sep,,,,,,43
Diploma in physiotherapy ,Diploma,3 Years,6,2200,6200,62400,Jan/Jun/July/Sep,,,,,,43
Diploma in Nursing ,Diploma,3 Years,6,2200,6200,51600,Jan/Jun/July/Sep,,,,,,43
Bachelor in accounting ,Bachelor,3.5 Years,7,2200,6200,59150,Apr/May/Sept/Nov,,,,,,43
Bachelor of Aircraft Engineering Technology (Hons) in Avionics,Bachelor,4 Years,8,2200,6200,84400,Apr/May/Sept/Nov,,,,,,43
Bachelor of Aircraft Engineering Technology (Hons) in Mechanical,Bachelor,4 Years,8,2200,6200,84400,Feb/ Sep,,,,,,43
Bachelor of Aviation Management (Hons.),Bachelor,4 Years,8,2200,6200,78000,Feb/ Sep,,,,,,43
Bachelor of Business Admin in Management and Entrepreneurship,Bachelor,4 Years,6,2200,6200,46800,Jan/Jun/July/Sep,,,,,,43
Bachelor of Business Administration (Hons) International Business,Bachelor,3 Years,6,2200,6200,50700,Jan/Jun/July/Sep,,,,,,43
Bachelor of Business Administration (Hons.) in Islamic Finance,Bachelor,3 Years,6,2200,6200,46800,Jan/Jun/July/Sep,,,,,,43
Bachelor of Business Technology (Hons.) in Computer Entrepreneurial Management,Bachelor,4 Yearss,8,2200,6200,70400,Jan/sep,,,,,,43
Bachelor of Chemical Engineering Technology (Hons.) in Bioprocess,Bachelor,4 Yearss,8,2200,6200,78000,jan/sep,,,,,,43
Bachelor of Chemical Engineering Technology in Environment,Bachelor,4 Yearss,8,2200,6200,78000,Jan/Apr/ August,,,,,,43
Bachelor of Chemical Engineering Technology (Hons.) in Food,Bachelor,4 Yearss,8,2200,6200,78000,Jan/Apr/ August,,,,,,43
Bachelor of Chemical Engineering Technology (Hons.) in Polymer,Bachelor,4 Yearss,8,2200,6200,78000,Jan/Apr/ August,,,,,,43
Bachelor of Chemical Engineering Technology (Hons.) in Process,Bachelor,4 Yearss,8,2200,6200,78000,Jan/Apr/ August,,,,,,43
Bachelor of Clinical Laboratory Science (Hons.),Bachelor,4 Yearss,8,2200,6200,78000,Jan/Apr/ August,,,,,,43
Bachelor of Computer Engineering (Hons.),Bachelor,4 Yearss,8,2200,6200,70400,Jan/Apr/ August,,,,,,43
Bachelor of Engineering Technology (Hons.) in Electronics,Bachelor,4 Yearss,8,2200,6200,78000,Jan/Apr/ August,,,,,,43
Bachelor of Engineering Technology (Hons) in Business Management,Bachelor,4 Yearss,8,2200,6200,78000,Jan/Apr/ August,,,,,,43
Bachelor of Engineering Technology (Hons) in Facilities Maintenance Engineering,Bachelor,4 Yearss,8,2200,6200,78000,Jan/Apr/ August,,,,,,43
Bachelor of Engineering Technology (Hons) in Industrial Design,Bachelor,4 Yearss,8,2200,6200,78000,Jan/Apr/ August,,,,,,43
Bachelor of Engineering Technology (Hons) in Instrumentation and Control Engineering,Bachelor,4 Yearss,8,2200,6200,78000,Jan/Apr/ August,,,,,,43
Bachelor of Engineering Technology (Hons) in Manufacturing Systems,Bachelor,4 Yearss,8,2200,6200,78000,Jan/Apr/ August,,,,,,43
Bachelor of Engineering Technology (Hons) in Marine Electrical & Electronic,Bachelor,4 Yearss,8,2200,6200,81200,Jan/Apr/ August,,,,,,43
Bachelor of Engineering Technology (Hons) in Naval Architecture & Shipbuilding,Bachelor,4 Yearss,8,2200,6200,78000,Jan/Apr/ August,,,,,,43
Bachelor of Engineering Technology (Hons) in Product Design,Bachelor,4 Yearss,8,2200,6200,78000,Jan/Apr/ August,,,,,,43
Bachelor of Engineering Technology (Hons) in Data communication,Bachelor,4 Yearss,8,2200,6200,78000,Jan/Apr/ August,,,,,,43
Bachelor of Engineering Technology (Hons) in Tool and Die,Bachelor,4 Years,8,2200,6200,78000,Anytime,,,,,,43
Bachelor of Engineering Technology (Hons) Marine Engineering,Bachelor,4 Years,8,2200,6200,79680,Anytime,,,,,,43
Bachelor of Engineering Technology (Hons.) in Air Conditioning and Industrial Refrigeration,Bachelor,4 Years,8,2200,6200,81200,Feb/ Sep,,,,,,43
Bachelor of Engineering Technology (Hons.) in Applied Electronics,Bachelor,4 Years,8,2200,6200,78000,Anytime,,,,,,43
Bachelor of Engineering Technology (Hons.) in Automotive Maintenance,Bachelor,4 Years,8,2200,6200,78000,Feb/ Sep,,,,,,43
Bachelor of Engineering Technology (Hons.) in Biosystem,Bachelor,4 Years,8,2200,6200,78000,Anytime,,,,,,43
Bachelor of Engineering Technology (Hons.) in Electrical,Bachelor,4 Years,8,2200,6200,83200,feb/sep,,,,,,43
Bachelor of Engineering Technology (Hons.) in Electromechanical System,Bachelor,4 Years,8,2200,6200,78000,feb/sep,,,,,,43
Bachelor of Engineering Technology (Hons.) in Industrial Automation and Robotics,Bachelor,4 Years,8,2200,6200,78000,feb/sep,,,,,,43
Bachelor of Engineering Technology (Hons.) in Machine Tools Manufacturing,Bachelor,4 Years,8,2200,6200,78000,feb/sep,,,,,,43
Bachelor of Engineering Technology (Hons.) in Manufacturing (Automotive),Bachelor,4 Years,8,2200,6200,78000,jan/sep,,,,,,43
Bachelor of Engineering Technology (Hons.) in Mechanical (Automotive),Bachelor,4 Years,8,2200,6200,78000,jan/sep,,,,,,43
Bachelor of Engineering Technology (Hons.) in Mechanical Design,Bachelor,4 Years,8,2200,6200,78000,jan/sep,,,,,,43
Bachelor of Engineering Technology (Hons.) in Mechatronics (Automotive),Bachelor,4 Years,8,2200,6200,78000,Jan/sep,,,,,,43
Bachelor of Engineering Technology (Hons.) in Mechatronics,Bachelor,4 Years,8,2200,6200,78000,feb/sep,,,,,,43
Bachelor of Engineering Technology (Hons.) in Medical Electronics,Bachelor,4 Years,8,2200,6200,78000,jan/sep,,,,,,43
Bachelor of Engineering Technology (Hons.) in Networking Systems,Bachelor,4 Years,8,2200,6200,78000,jan/sep,,,,,,43
Bachelor of Engineering Technology (Hons.) in Quality Engineering,Bachelor,4 Years,8,2200,6200,78000,jan/sep,,,,,,43
Bachelor of Engineering Technology (Hons.) in Welding and Quality Inspection,Bachelor,4 Years,8,2200,6200,78000,jan/sep,,,,,,43
Bachelor of Engineering with Honours (Chemical),Bachelor,4 Years,8,2200,6200,87200,jan/sep,,,,,,43
Bachelor of Engineering with Honours (Electrical),Bachelor,4 Years,8,2200,6200,78000,feb/sep,,,,,,43
Bachelor of Industrial Logistics (Hons.),Bachelor,4 Years,8,2200,6200,78000,feb/sep,,,,,,43
 Bachelor of Industrial Logistics (Hons.),Bachelor,4 Years,8,2200,6200,78000,feb/sep,,,,,,43
Bachelor of Information Technology (Hons.) in Software Engineering,Bachelor,4 Years,8,2200,6200,70400,feb/sep,,,,,,43
Bachelor of Maritime Operations (Hons),Bachelor,4 Years,8,2200,6200,72800,feb/sep,,,,,,43
Bachelor of Mechanical Engineering (Hons.),Bachelor,4 Years,8,2200,6200,64000,feb/sep,,,,,,43
Bachelor of Medical Science Technology in Environmental Healthcare (Hons.),Bachelor,4 Years,8,2200,6200,78000,feb/sep,,,,,,43
Bachelor of Medicine and Bachelor of Surgery (MBBS),Bachelor,5 Years,8,2200,6200,312000,sep,,,,,,43
Bachelor of Multimedia Technology (Hons) in Computer Animation,Bachelor,4 Years,8,2200,6200,78000,,,,,,,43
Bachelor of Multimedia Technology (Hons.) in Interactive Multimedia Design,Bachelor,4 Years,8,2200,6200,70400,,,,,,,43
Bachelor of Pharmacy (Honours),Bachelor,4 Years,8,2200,6200,176800,,,,,,,43
Bachelor of Technology Management (Hons),Bachelor,4 Years,8,2200,6200,76000,,,,,,,43
Masters in Computer Science,Masters,1.5 Years,3,2200,6200,24000,Jan/sep,,,,,,43
Masters in Manufacturing Management,Masters,1.5 Years,3,2200,6200,27000,January_July,,,,,,43
Masters of Business Administration (Entrepreneurship),Masters,1.5 Years,3,2200,6200,27000,January_September,,,,,,43
Masters of Business Administration,Masters,1.5 Years,3,2200,6200,27000,january -sep,,,,,,43
Masters of Engineering Technology (Chemical Engineering),Masters,2 Years,4,2200,6200,10000,january -sep,"Food Technology, Chemical & Bioengineering",,,,,43
Masters of Engineering Technology (Electrical and Electronic) (by research),Masters,2 Years,4,2200,6200,10000,janu/sep,,,,,,43
"Masters of Engineering Technology (Green and Energy Efficient Buildings) - joint award between University Kuala Lumpur and University of Applied Sciences Rosenheim (UAS RO), Germany - full time and part time",Masters,2 Years,4,2200,6200,53800,janu sep,,,,,,43
Masters of Engineering Technology (Industrial Automation),Masters,2 Years,4,2200,6200,10000,janu sep,,,,,,43
Masters of Engineering Technology (Manufacturing),Masters,2 Years,4,2200,6200,10000,janu sep,,,,,,43
Masters of Engineering Technology (Aerospace),Masters,2 Years,4,2200,6200,10000,janu sep,,,,,,43
Masters of Engineering Technology (Mechanical),Masters,2 Years,4,2200,6200,10000,anytime,,,,,,43
Masters of Information Technology (By Research),Masters,2 Years,4,2200,6200,10000,janu / sep,,2500 per semester,,,,43
Masters of Management,Masters,1.5 Years,3,2200,6200,10000,jan sep,,,,,,43
Masters of Medical Science  ,Masters,2 Years,4,2200,6200,28000,jan sep,,,,,,43
Masters of public health ,Masters,2 Years,4,2200,6200,22000,jan sep,,,,,,43
Masters of Science in public health ,Masters,2 Years,4,2200,6200,20000,jan sep,,,,,,43
Masters of science( water and hydropower Engineering),Masters,3 Years,4,2200,6200,110400,jan sep,,,,,,43
Doctor of Philosophy (Chemical Engineering),PhD,3 Years,6,2200,6200,35300,anytime,,,,,,43
Doctor of Philosophy (Industrial Automation),PhD,3 Years,6,2200,6200,35300,anytime,,,,,,43
Doctor of Philosophy (Information Technology),PhD,3 Years,6,2200,6200,35300,anytime,,,,,,43
Doctor of Philosophy (Manufacturing),PhD,3 Years,6,2200,6200,35300,anytime,,,,,,43
Doctor of Philosophy in Engineering Technology (Electrical/Electronic) (by research),PhD,3 Years,6,2200,6200,35300,anytime,,,,,,43
Doctor of Philosophy in Management,PhD,3 Years,6,2200,6200,35300,anytime,,,,,,43
Doctor of Philosphy (Medical Sciences),PhD,3 Years,6,2200,6200,52500,anytime,,,,,,43
Doctor of Philosphy (Pharmacy),PhD,3 Years,6,2200,6200,40800,anytime,,,,,,43
